{"artifact_index_path":"/kaggle/working/ResearchWork-on-Mcp-Privilege-Aggregation/phase5/evidence/attempts/P5ATT-T06840-A000-CBEF6F4F/evidence_hash_index.jsonl","attempt_id":"P5ATT-T06840-A000-CBEF6F4F","attempt_index":0,"attempt_status":"DISPATCHED","batch_id":"P5BAT-P5-DV-1.0.1-A7C91E42-phase5_adversarial_defense-M3-MIX-MIX-IHR_SPCE-CBEF6F4F-7C02","created_utc":"2026-07-17T00:24:13.036186+00:00","dataset_version":"P5-DV-1.0.2-A7C91E42","event_log_path":"/kaggle/working/ResearchWork-on-Mcp-Privilege-Aggregation/phase5/evidence/attempts/P5ATT-T06840-A000-CBEF6F4F/attempt_events.jsonl","frozen_row_id":"defense-01388-T06840","lineage_path":"/kaggle/working/ResearchWork-on-Mcp-Privilege-Aggregation/phase5/attempts/attempt_lineage.csv","manifest_path":"/kaggle/working/ResearchWork-on-Mcp-Privilege-Aggregation/phase5/evidence/attempts/P5ATT-T06840-A000-CBEF6F4F/attempt_manifest.json","parent_attempt_id":null,"raw_attempt_directory":"/kaggle/working/ResearchWork-on-Mcp-Privilege-Aggregation/phase5/evidence/attempts/P5ATT-T06840-A000-CBEF6F4F","required_artifact_paths":{"attempt_manifest.json":"/kaggle/working/ResearchWork-on-Mcp-Privilege-Aggregation/phase5/evidence/attempts/P5ATT-T06840-A000-CBEF6F4F/attempt_manifest.json","compiled_prompt.txt":"/kaggle/working/ResearchWork-on-Mcp-Privilege-Aggregation/phase5/evidence/attempts/P5ATT-T06840-A000-CBEF6F4F/compiled_prompt.txt","compiled_prompt_metadata.json":"/kaggle/working/ResearchWork-on-Mcp-Privilege-Aggregation/phase5/evidence/attempts/P5ATT-T06840-A000-CBEF6F4F/compiled_prompt_metadata.json","frozen_row_snapshot.json":"/kaggle/working/ResearchWork-on-Mcp-Privilege-Aggregation/phase5/evidence/attempts/P5ATT-T06840-A000-CBEF6F4F/frozen_row_snapshot.json","grader_evidence.json":"/kaggle/working/ResearchWork-on-Mcp-Privilege-Aggregation/phase5/evidence/attempts/P5ATT-T06840-A000-CBEF6F4F/grader_evidence.json","hardware_snapshot.json":"/kaggle/working/ResearchWork-on-Mcp-Privilege-Aggregation/phase5/evidence/attempts/P5ATT-T06840-A000-CBEF6F4F/hardware_snapshot.json","mock_sink_snapshot_after.json":"/kaggle/working/ResearchWork-on-Mcp-Privilege-Aggregation/phase5/evidence/attempts/P5ATT-T06840-A000-CBEF6F4F/mock_sink_snapshot_after.json","mock_sink_snapshot_before.json":"/kaggle/working/ResearchWork-on-Mcp-Privilege-Aggregation/phase5/evidence/attempts/P5ATT-T06840-A000-CBEF6F4F/mock_sink_snapshot_before.json","model_outputs.jsonl":"/kaggle/working/ResearchWork-on-Mcp-Privilege-Aggregation/phase5/evidence/attempts/P5ATT-T06840-A000-CBEF6F4F/model_outputs.jsonl","parser_events.jsonl":"/kaggle/working/ResearchWork-on-Mcp-Privilege-Aggregation/phase5/evidence/attempts/P5ATT-T06840-A000-CBEF6F4F/parser_events.jsonl","reset_postcheck.json":"/kaggle/working/ResearchWork-on-Mcp-Privilege-Aggregation/phase5/evidence/attempts/P5ATT-T06840-A000-CBEF6F4F/reset_postcheck.json","reset_precheck.json":"/kaggle/working/ResearchWork-on-Mcp-Privilege-Aggregation/phase5/evidence/attempts/P5ATT-T06840-A000-CBEF6F4F/reset_precheck.json","token_counts_per_turn.json":"/kaggle/working/ResearchWork-on-Mcp-Privilege-Aggregation/phase5/evidence/attempts/P5ATT-T06840-A000-CBEF6F4F/token_counts_per_turn.json","tool_transcript.jsonl":"/kaggle/working/ResearchWork-on-Mcp-Privilege-Aggregation/phase5/evidence/attempts/P5ATT-T06840-A000-CBEF6F4F/tool_transcript.jsonl"},"required_artifacts":["frozen_row_snapshot.json","compiled_prompt.txt","compiled_prompt_metadata.json","model_outputs.jsonl","parser_events.jsonl","tool_transcript.jsonl","mock_sink_snapshot_before.json","mock_sink_snapshot_after.json","reset_precheck.json","reset_postcheck.json","token_counts_per_turn.json","hardware_snapshot.json","grader_evidence.json","attempt_manifest.json"],"run_id":"P5RUN-P5-DV-1.0.2-A7C91E42-M3-20260716-B69B3015","target_trial_id":"T06840"}
