{"artifact_index_path":"/kaggle/working/ResearchWork-on-Mcp-Privilege-Aggregation/phase5/evidence/attempts/P5ATT-T00144-A000-981E50DE/evidence_hash_index.jsonl","attempt_id":"P5ATT-T00144-A000-981E50DE","attempt_index":0,"attempt_status":"DISPATCHED","batch_id":"P5BAT-P5-DV-1.0.1-A7C91E42-phase5_adversarial_core-M1-MIX-MIX-BASELINE-981E50DE-5ACF","created_utc":"2026-07-16T04:30:17.685146+00:00","dataset_version":"P5-DV-1.0.2-A7C91E42","event_log_path":"/kaggle/working/ResearchWork-on-Mcp-Privilege-Aggregation/phase5/evidence/attempts/P5ATT-T00144-A000-981E50DE/attempt_events.jsonl","frozen_row_id":"core-02917-T00144","lineage_path":"/kaggle/working/ResearchWork-on-Mcp-Privilege-Aggregation/phase5/attempts/attempt_lineage.csv","manifest_path":"/kaggle/working/ResearchWork-on-Mcp-Privilege-Aggregation/phase5/evidence/attempts/P5ATT-T00144-A000-981E50DE/attempt_manifest.json","parent_attempt_id":null,"raw_attempt_directory":"/kaggle/working/ResearchWork-on-Mcp-Privilege-Aggregation/phase5/evidence/attempts/P5ATT-T00144-A000-981E50DE","required_artifact_paths":{"attempt_manifest.json":"/kaggle/working/ResearchWork-on-Mcp-Privilege-Aggregation/phase5/evidence/attempts/P5ATT-T00144-A000-981E50DE/attempt_manifest.json","compiled_prompt.txt":"/kaggle/working/ResearchWork-on-Mcp-Privilege-Aggregation/phase5/evidence/attempts/P5ATT-T00144-A000-981E50DE/compiled_prompt.txt","compiled_prompt_metadata.json":"/kaggle/working/ResearchWork-on-Mcp-Privilege-Aggregation/phase5/evidence/attempts/P5ATT-T00144-A000-981E50DE/compiled_prompt_metadata.json","frozen_row_snapshot.json":"/kaggle/working/ResearchWork-on-Mcp-Privilege-Aggregation/phase5/evidence/attempts/P5ATT-T00144-A000-981E50DE/frozen_row_snapshot.json","grader_evidence.json":"/kaggle/working/ResearchWork-on-Mcp-Privilege-Aggregation/phase5/evidence/attempts/P5ATT-T00144-A000-981E50DE/grader_evidence.json","hardware_snapshot.json":"/kaggle/working/ResearchWork-on-Mcp-Privilege-Aggregation/phase5/evidence/attempts/P5ATT-T00144-A000-981E50DE/hardware_snapshot.json","mock_sink_snapshot_after.json":"/kaggle/working/ResearchWork-on-Mcp-Privilege-Aggregation/phase5/evidence/attempts/P5ATT-T00144-A000-981E50DE/mock_sink_snapshot_after.json","mock_sink_snapshot_before.json":"/kaggle/working/ResearchWork-on-Mcp-Privilege-Aggregation/phase5/evidence/attempts/P5ATT-T00144-A000-981E50DE/mock_sink_snapshot_before.json","model_outputs.jsonl":"/kaggle/working/ResearchWork-on-Mcp-Privilege-Aggregation/phase5/evidence/attempts/P5ATT-T00144-A000-981E50DE/model_outputs.jsonl","parser_events.jsonl":"/kaggle/working/ResearchWork-on-Mcp-Privilege-Aggregation/phase5/evidence/attempts/P5ATT-T00144-A000-981E50DE/parser_events.jsonl","reset_postcheck.json":"/kaggle/working/ResearchWork-on-Mcp-Privilege-Aggregation/phase5/evidence/attempts/P5ATT-T00144-A000-981E50DE/reset_postcheck.json","reset_precheck.json":"/kaggle/working/ResearchWork-on-Mcp-Privilege-Aggregation/phase5/evidence/attempts/P5ATT-T00144-A000-981E50DE/reset_precheck.json","token_counts_per_turn.json":"/kaggle/working/ResearchWork-on-Mcp-Privilege-Aggregation/phase5/evidence/attempts/P5ATT-T00144-A000-981E50DE/token_counts_per_turn.json","tool_transcript.jsonl":"/kaggle/working/ResearchWork-on-Mcp-Privilege-Aggregation/phase5/evidence/attempts/P5ATT-T00144-A000-981E50DE/tool_transcript.jsonl"},"required_artifacts":["frozen_row_snapshot.json","compiled_prompt.txt","compiled_prompt_metadata.json","model_outputs.jsonl","parser_events.jsonl","tool_transcript.jsonl","mock_sink_snapshot_before.json","mock_sink_snapshot_after.json","reset_precheck.json","reset_postcheck.json","token_counts_per_turn.json","hardware_snapshot.json","grader_evidence.json","attempt_manifest.json"],"run_id":"P5RUN-P5-DV-1.0.2-A7C91E42-M1-20260716-2EFE3D90","target_trial_id":"T00144"}
