{"artifact_index_path":"/kaggle/working/ResearchWork-on-Mcp-Privilege-Aggregation/phase5_5/evidence/attempts/P5RUN-P5-DV-1.1.0-TREATMENT-V3-M1-20260724-2BF1896B/P5ATT-T01091-A000-2BF1896B/evidence_hash_index.jsonl","attempt_id":"P5ATT-T01091-A000-2BF1896B","attempt_index":0,"attempt_status":"OFFICIAL_ACCEPTED","batch_id":"P5BAT-P5-DV-1.1.0-TREATMENT-V3-phase5_adversarial_core-M1-MIX-MIX-BASELINE-FAD1C61B-3840","created_utc":"2026-07-24T10:28:00.637456+00:00","dataset_version":"P5-DV-1.1.0-TREATMENT-V3","event_log_path":"/kaggle/working/ResearchWork-on-Mcp-Privilege-Aggregation/phase5_5/evidence/attempts/P5RUN-P5-DV-1.1.0-TREATMENT-V3-M1-20260724-2BF1896B/P5ATT-T01091-A000-2BF1896B/attempt_events.jsonl","frozen_row_id":"core-00668-T01091","lineage_path":"/kaggle/working/ResearchWork-on-Mcp-Privilege-Aggregation/phase5_5/attempts/attempt_lineage.csv","manifest_path":"/kaggle/working/ResearchWork-on-Mcp-Privilege-Aggregation/phase5_5/evidence/attempts/P5RUN-P5-DV-1.1.0-TREATMENT-V3-M1-20260724-2BF1896B/P5ATT-T01091-A000-2BF1896B/attempt_manifest.json","parent_attempt_id":null,"raw_attempt_directory":"/kaggle/working/ResearchWork-on-Mcp-Privilege-Aggregation/phase5_5/evidence/attempts/P5RUN-P5-DV-1.1.0-TREATMENT-V3-M1-20260724-2BF1896B/P5ATT-T01091-A000-2BF1896B","required_artifact_paths":{"attempt_manifest.json":"/kaggle/working/ResearchWork-on-Mcp-Privilege-Aggregation/phase5_5/evidence/attempts/P5RUN-P5-DV-1.1.0-TREATMENT-V3-M1-20260724-2BF1896B/P5ATT-T01091-A000-2BF1896B/attempt_manifest.json","compiled_prompt.txt":"/kaggle/working/ResearchWork-on-Mcp-Privilege-Aggregation/phase5_5/evidence/attempts/P5RUN-P5-DV-1.1.0-TREATMENT-V3-M1-20260724-2BF1896B/P5ATT-T01091-A000-2BF1896B/compiled_prompt.txt","compiled_prompt_metadata.json":"/kaggle/working/ResearchWork-on-Mcp-Privilege-Aggregation/phase5_5/evidence/attempts/P5RUN-P5-DV-1.1.0-TREATMENT-V3-M1-20260724-2BF1896B/P5ATT-T01091-A000-2BF1896B/compiled_prompt_metadata.json","frozen_row_snapshot.json":"/kaggle/working/ResearchWork-on-Mcp-Privilege-Aggregation/phase5_5/evidence/attempts/P5RUN-P5-DV-1.1.0-TREATMENT-V3-M1-20260724-2BF1896B/P5ATT-T01091-A000-2BF1896B/frozen_row_snapshot.json","grader_evidence.json":"/kaggle/working/ResearchWork-on-Mcp-Privilege-Aggregation/phase5_5/evidence/attempts/P5RUN-P5-DV-1.1.0-TREATMENT-V3-M1-20260724-2BF1896B/P5ATT-T01091-A000-2BF1896B/grader_evidence.json","hardware_snapshot.json":"/kaggle/working/ResearchWork-on-Mcp-Privilege-Aggregation/phase5_5/evidence/attempts/P5RUN-P5-DV-1.1.0-TREATMENT-V3-M1-20260724-2BF1896B/P5ATT-T01091-A000-2BF1896B/hardware_snapshot.json","mock_sink_snapshot_after.json":"/kaggle/working/ResearchWork-on-Mcp-Privilege-Aggregation/phase5_5/evidence/attempts/P5RUN-P5-DV-1.1.0-TREATMENT-V3-M1-20260724-2BF1896B/P5ATT-T01091-A000-2BF1896B/mock_sink_snapshot_after.json","mock_sink_snapshot_before.json":"/kaggle/working/ResearchWork-on-Mcp-Privilege-Aggregation/phase5_5/evidence/attempts/P5RUN-P5-DV-1.1.0-TREATMENT-V3-M1-20260724-2BF1896B/P5ATT-T01091-A000-2BF1896B/mock_sink_snapshot_before.json","model_outputs.jsonl":"/kaggle/working/ResearchWork-on-Mcp-Privilege-Aggregation/phase5_5/evidence/attempts/P5RUN-P5-DV-1.1.0-TREATMENT-V3-M1-20260724-2BF1896B/P5ATT-T01091-A000-2BF1896B/model_outputs.jsonl","parser_events.jsonl":"/kaggle/working/ResearchWork-on-Mcp-Privilege-Aggregation/phase5_5/evidence/attempts/P5RUN-P5-DV-1.1.0-TREATMENT-V3-M1-20260724-2BF1896B/P5ATT-T01091-A000-2BF1896B/parser_events.jsonl","reset_postcheck.json":"/kaggle/working/ResearchWork-on-Mcp-Privilege-Aggregation/phase5_5/evidence/attempts/P5RUN-P5-DV-1.1.0-TREATMENT-V3-M1-20260724-2BF1896B/P5ATT-T01091-A000-2BF1896B/reset_postcheck.json","reset_precheck.json":"/kaggle/working/ResearchWork-on-Mcp-Privilege-Aggregation/phase5_5/evidence/attempts/P5RUN-P5-DV-1.1.0-TREATMENT-V3-M1-20260724-2BF1896B/P5ATT-T01091-A000-2BF1896B/reset_precheck.json","token_counts_per_turn.json":"/kaggle/working/ResearchWork-on-Mcp-Privilege-Aggregation/phase5_5/evidence/attempts/P5RUN-P5-DV-1.1.0-TREATMENT-V3-M1-20260724-2BF1896B/P5ATT-T01091-A000-2BF1896B/token_counts_per_turn.json","tool_transcript.jsonl":"/kaggle/working/ResearchWork-on-Mcp-Privilege-Aggregation/phase5_5/evidence/attempts/P5RUN-P5-DV-1.1.0-TREATMENT-V3-M1-20260724-2BF1896B/P5ATT-T01091-A000-2BF1896B/tool_transcript.jsonl"},"required_artifacts":["frozen_row_snapshot.json","compiled_prompt.txt","compiled_prompt_metadata.json","model_outputs.jsonl","parser_events.jsonl","tool_transcript.jsonl","mock_sink_snapshot_before.json","mock_sink_snapshot_after.json","reset_precheck.json","reset_postcheck.json","token_counts_per_turn.json","hardware_snapshot.json","grader_evidence.json","attempt_manifest.json"],"run_id":"P5RUN-P5-DV-1.1.0-TREATMENT-V3-M1-20260724-2BF1896B","target_trial_id":"T01091"}
