{"artifact_index_path":"/kaggle/working/ResearchWork-on-Mcp-Privilege-Aggregation/phase5_5/evidence/attempts/P5ATT-T02287-A000-1E887568/evidence_hash_index.jsonl","attempt_id":"P5ATT-T02287-A000-1E887568","attempt_index":0,"attempt_status":"DISPATCHED","batch_id":"P5BAT-P5-DV-1.0.2-A7C91E42-phase5_adversarial_core-M2-MIX-MIX-BASELINE-1E887568-F22B","created_utc":"2026-07-19T00:07:27.737454+00:00","dataset_version":"P5-DV-1.0.2-A7C91E42","event_log_path":"/kaggle/working/ResearchWork-on-Mcp-Privilege-Aggregation/phase5_5/evidence/attempts/P5ATT-T02287-A000-1E887568/attempt_events.jsonl","frozen_row_id":"core-01590-T02287","lineage_path":"/kaggle/working/ResearchWork-on-Mcp-Privilege-Aggregation/phase5_5/attempts/attempt_lineage.csv","manifest_path":"/kaggle/working/ResearchWork-on-Mcp-Privilege-Aggregation/phase5_5/evidence/attempts/P5ATT-T02287-A000-1E887568/attempt_manifest.json","parent_attempt_id":null,"raw_attempt_directory":"/kaggle/working/ResearchWork-on-Mcp-Privilege-Aggregation/phase5_5/evidence/attempts/P5ATT-T02287-A000-1E887568","required_artifact_paths":{"attempt_manifest.json":"/kaggle/working/ResearchWork-on-Mcp-Privilege-Aggregation/phase5_5/evidence/attempts/P5ATT-T02287-A000-1E887568/attempt_manifest.json","compiled_prompt.txt":"/kaggle/working/ResearchWork-on-Mcp-Privilege-Aggregation/phase5_5/evidence/attempts/P5ATT-T02287-A000-1E887568/compiled_prompt.txt","compiled_prompt_metadata.json":"/kaggle/working/ResearchWork-on-Mcp-Privilege-Aggregation/phase5_5/evidence/attempts/P5ATT-T02287-A000-1E887568/compiled_prompt_metadata.json","frozen_row_snapshot.json":"/kaggle/working/ResearchWork-on-Mcp-Privilege-Aggregation/phase5_5/evidence/attempts/P5ATT-T02287-A000-1E887568/frozen_row_snapshot.json","grader_evidence.json":"/kaggle/working/ResearchWork-on-Mcp-Privilege-Aggregation/phase5_5/evidence/attempts/P5ATT-T02287-A000-1E887568/grader_evidence.json","hardware_snapshot.json":"/kaggle/working/ResearchWork-on-Mcp-Privilege-Aggregation/phase5_5/evidence/attempts/P5ATT-T02287-A000-1E887568/hardware_snapshot.json","mock_sink_snapshot_after.json":"/kaggle/working/ResearchWork-on-Mcp-Privilege-Aggregation/phase5_5/evidence/attempts/P5ATT-T02287-A000-1E887568/mock_sink_snapshot_after.json","mock_sink_snapshot_before.json":"/kaggle/working/ResearchWork-on-Mcp-Privilege-Aggregation/phase5_5/evidence/attempts/P5ATT-T02287-A000-1E887568/mock_sink_snapshot_before.json","model_outputs.jsonl":"/kaggle/working/ResearchWork-on-Mcp-Privilege-Aggregation/phase5_5/evidence/attempts/P5ATT-T02287-A000-1E887568/model_outputs.jsonl","parser_events.jsonl":"/kaggle/working/ResearchWork-on-Mcp-Privilege-Aggregation/phase5_5/evidence/attempts/P5ATT-T02287-A000-1E887568/parser_events.jsonl","reset_postcheck.json":"/kaggle/working/ResearchWork-on-Mcp-Privilege-Aggregation/phase5_5/evidence/attempts/P5ATT-T02287-A000-1E887568/reset_postcheck.json","reset_precheck.json":"/kaggle/working/ResearchWork-on-Mcp-Privilege-Aggregation/phase5_5/evidence/attempts/P5ATT-T02287-A000-1E887568/reset_precheck.json","token_counts_per_turn.json":"/kaggle/working/ResearchWork-on-Mcp-Privilege-Aggregation/phase5_5/evidence/attempts/P5ATT-T02287-A000-1E887568/token_counts_per_turn.json","tool_transcript.jsonl":"/kaggle/working/ResearchWork-on-Mcp-Privilege-Aggregation/phase5_5/evidence/attempts/P5ATT-T02287-A000-1E887568/tool_transcript.jsonl"},"required_artifacts":["frozen_row_snapshot.json","compiled_prompt.txt","compiled_prompt_metadata.json","model_outputs.jsonl","parser_events.jsonl","tool_transcript.jsonl","mock_sink_snapshot_before.json","mock_sink_snapshot_after.json","reset_precheck.json","reset_postcheck.json","token_counts_per_turn.json","hardware_snapshot.json","grader_evidence.json","attempt_manifest.json"],"run_id":"P5RUN-P5-DV-1.0.2-A7C91E42-M2-20260718-0A3C9E18","target_trial_id":"T02287"}
